{"type":"config","name":"atoms test coverage efficiency (stairstep)","metricName":"efficiency","metricUnit":"","bestDirection":"lower"}
{"run":1,"commit":"dddb699","metric":3.7,"metrics":{"covered_lines":865,"coverage_pct":89.5,"miss":74,"test_time_s":1.172,"test_loc":2732,"branch_pct":83.5},"status":"keep","description":"Baseline: atoms coverage 89.5%, 865/939 lines, 74 miss, efficiency=3.7","timestamp":1774149913017,"segment":0}
{"run":2,"commit":"d51f2cf","metric":7.59,"metrics":{"covered_lines":886,"coverage_pct":92,"miss":53,"test_time_s":2.415,"test_loc":2785,"branch_pct":86.7},"status":"keep","description":"Step up: fact protocol edges, sequential empty, types fallthrough, upsert refs, unknown fold — +21 covered lines (865→886)","timestamp":1774150121468,"segment":0}
{"run":3,"commit":"8ceb0f5","metric":2.9,"metrics":{"covered_lines":906,"coverage_pct":94.8,"miss":33,"test_time_s":0.922,"test_loc":2851,"branch_pct":91},"status":"keep","description":"Step up: parse.py type guards + dispatch branches — +20 covered (886→906), efficiency 2.9 (new best)","timestamp":1774150245856,"segment":0}
{"run":4,"commit":"ee87509","metric":3.8,"metrics":{"covered_lines":916,"coverage_pct":96.2,"miss":23,"test_time_s":1.21,"test_loc":2875,"branch_pct":93},"status":"keep","description":"Step up: parse single-op dispatch + fact repr/__replace__ — +10 covered (906→916), 96.2% coverage","timestamp":1774150317558,"segment":0}
{"run":5,"commit":"573597e","metric":3.03,"metrics":{"covered_lines":931,"coverage_pct":98.1,"miss":8,"test_time_s":0.958,"test_loc":2949,"branch_pct":95.6},"status":"keep","description":"Step up: source.py parse helpers + subprocess edges (ndjson, env, explode) — +15 covered (916→931), 98.1%","timestamp":1774150394855,"segment":0}
{"type":"config","name":"engine test coverage efficiency (stairstep)","metricName":"efficiency","metricUnit":"","bestDirection":"lower"}
{"run":1,"commit":"0a4848a","metric":6.97,"metrics":{"covered_lines":2304,"coverage_pct":83.4,"miss":341,"test_time_s":2,"test_loc":8030,"branch_pct":74.2},"status":"keep","description":"Baseline: engine coverage 83.4%, 2304/2645 lines, 341 miss, efficiency=6.97","timestamp":1774150596386,"segment":0}
{"run":2,"commit":"70d4306","metric":5.88,"metrics":{"covered_lines":2332,"coverage_pct":84.6,"miss":313,"test_time_s":1.692,"test_loc":8110,"branch_pct":75.7},"status":"keep","description":"Step up: peer restrict_grant, program protocol, cadence __str__, store_reader tick/freshness/entity, __init__ — +28 covered (2304→2332)","timestamp":1774150801214,"segment":0}
{"run":3,"commit":"1683c5c","metric":9.02,"metrics":{"covered_lines":2352,"coverage_pct":85.3,"miss":293,"test_time_s":2.589,"test_loc":8196,"branch_pct":76.5},"status":"keep","description":"Step up: sqlite_store fact fast-path, builder fold/boundary/route methods, compiler repr/eq — +20 covered (2332→2352)","timestamp":1774150969556,"segment":0}
{"run":4,"commit":"f1fef5b","metric":8.26,"metrics":{"covered_lines":2374,"coverage_pct":86.3,"miss":271,"test_time_s":2.353,"test_loc":8336,"branch_pct":77.8},"status":"keep","description":"Step up: test SDK + vertex replay paths (routes, parse, children, boundary reconciliation, ingest) — +22 covered (2352→2374)","timestamp":1774151200978,"segment":0}
{"run":5,"commit":"a212982","metric":5.99,"metrics":{"covered_lines":2380,"coverage_pct":86.6,"miss":265,"test_time_s":1.699,"test_loc":8388,"branch_pct":78.1},"status":"keep","description":"Step up: executor SourceError/on_error, program skip_sources — +6 covered (2374→2380), efficiency 5.99","timestamp":1774151342264,"segment":0}
{"run":6,"commit":"ed71668","metric":6.33,"metrics":{"covered_lines":2414,"coverage_pct":88,"miss":231,"test_time_s":1.803,"test_loc":8470,"branch_pct":79.9},"status":"keep","description":"Step up: vertex_reader summary/ticks/fact_by_id + resolve_store — +34 covered (2380→2414), 88.0%","timestamp":1774151448125,"segment":0}
{"run":7,"commit":"ff751a2","metric":6.64,"metrics":{"covered_lines":2435,"coverage_pct":88.9,"miss":210,"test_time_s":1.892,"test_loc":8552,"branch_pct":81.2},"status":"keep","description":"Step up: vertex_fold, vertex_tick_fold, vertex_facts edges — +21 covered (2414→2435), 88.9%","timestamp":1774151537721,"segment":0}
{"run":8,"commit":"d3655e6","metric":5.51,"metrics":{"covered_lines":2440,"coverage_pct":89.2,"miss":205,"test_time_s":1.567,"test_loc":8585,"branch_pct":81.6},"status":"keep","description":"Step up: compiler map_transform lstrip/rstrip/replace + unknown fold/boundary — +5 covered (2435→2440), efficiency 5.51","timestamp":1774151683174,"segment":0}
{"run":9,"commit":"6ff1e9b","metric":6.12,"metrics":{"covered_lines":2441,"coverage_pct":89.3,"miss":204,"test_time_s":1.733,"test_loc":8624,"branch_pct":81.7},"status":"keep","description":"Step up: replay boundary reconciliation edges (after not exhausted, vertex boundary period) — +1 covered (2440→2441)","timestamp":1774151801084,"segment":0}
{"run":10,"commit":"6ff1e9b","metric":6.26,"metrics":{"covered_lines":2441,"coverage_pct":89.3,"miss":204,"test_time_s":1.775,"test_loc":8605,"branch_pct":81.7},"status":"discard","description":"Step down attempt: remove low-ROI vertex boundary test — coverage unchanged, efficiency noise (6.26 vs 5.51 best)","timestamp":1774151847973,"segment":0}
{"type":"config","name":"engine coverage efficiency (warmup+min3)","metricName":"efficiency","metricUnit":"","bestDirection":"lower"}
{"run":1,"commit":"a5f34f1","metric":10.54,"metrics":{"covered_lines":2441,"coverage_pct":89.3,"miss":204,"test_time_s":2.982,"test_loc":8624,"branch_pct":81.7},"status":"keep","description":"Baseline (warmup+min3): engine 89.3%, 2441/2645 covered, 204 miss, efficiency=10.54","timestamp":1774152101171,"segment":0}
{"type":"config","name":"engine coverage efficiency (warmup+min3, pytest timing)","metricName":"efficiency","metricUnit":"","bestDirection":"lower"}
{"run":1,"commit":"e27ff53","metric":6.75,"metrics":{"covered_lines":2441,"coverage_pct":89.3,"miss":204,"test_time_s":1.91,"test_loc":8624,"branch_pct":81.7},"status":"keep","description":"Baseline (warmup+min3, pytest timing): engine 89.3%, 2441/2645 covered, 204 miss","timestamp":1774152218026,"segment":0}
{"run":2,"commit":"fa1ca1a","metric":11.66,"metrics":{"covered_lines":2462,"coverage_pct":90.2,"miss":183,"test_time_s":3.28,"test_loc":8749,"branch_pct":83},"status":"keep","description":"Step up: evaluate_boundaries + _evaluate_vertex_only_boundaries — +21 covered (2441→2462), 90.2%, vertex.py 55→34 miss","timestamp":1774152361583,"segment":0}
{"run":3,"commit":"e0a9f55","metric":11.25,"metrics":{"covered_lines":2471,"coverage_pct":90.6,"miss":174,"test_time_s":3.12,"test_loc":8913,"branch_pct":83.6},"status":"keep","description":"Step up: mixed boundaries + since_raw fast path (empty, mut_dispatch proxy) — +30 covered (2441→2471), 90.6%, vertex.py 55→25 miss","timestamp":1774152576986,"segment":0}
{"run":4,"commit":"285e33f","metric":10.31,"metrics":{"covered_lines":2484,"coverage_pct":91.1,"miss":161,"test_time_s":2.82,"test_loc":9080,"branch_pct":84.2},"status":"keep","description":"Step up: replay routes fallback + vertex-only conditions fire + non-matching kind — +13 covered (2471→2484), 91.1%, vertex.py 25→12 miss","timestamp":1774152816913,"segment":0}
{"run":5,"commit":"93a78d1","metric":14.02,"metrics":{"covered_lines":2489,"coverage_pct":91.4,"miss":156,"test_time_s":3.83,"test_loc":9112,"branch_pct":84.6},"status":"keep","description":"Step up: compiler every+on conflict + materialize parse_pipelines — +5 covered (2484→2489), 91.4%, vertex.py 12→9 miss","timestamp":1774153031082,"segment":0}
{"run":6,"commit":"62531a0","metric":16.01,"metrics":{"covered_lines":2493,"coverage_pct":91.6,"miss":152,"test_time_s":4.34,"test_loc":9195,"branch_pct":85},"status":"keep","description":"Step up: specs_match, raw_to_fold_state, extract_field, vertex_read edges — +4 covered (2489→2493), 91.6%","timestamp":1774153459682,"segment":0}
{"run":7,"commit":"ff26da4","metric":15.35,"metrics":{"covered_lines":2493,"coverage_pct":91.6,"miss":152,"test_time_s":4.18,"test_loc":9157,"branch_pct":85},"status":"keep","description":"Step down: compress inject_fact helper, remove duplicate imports — -38 LOC, coverage unchanged, efficiency 16.01→15.35","timestamp":1774153613690,"segment":0}
{"run":8,"commit":"f9584fb","metric":13.82,"metrics":{"covered_lines":2500,"coverage_pct":91.9,"miss":145,"test_time_s":3.75,"test_loc":9211,"branch_pct":85.5},"status":"keep","description":"Step up: vertex_fold combine path + specs_match + observer filter — +7 covered (2493→2500), 91.9%","timestamp":1774153863477,"segment":0}
{"run":9,"commit":"9632b6f","metric":15.96,"metrics":{"covered_lines":2506,"coverage_pct":92.2,"miss":139,"test_time_s":4.33,"test_loc":9236,"branch_pct":85.8},"status":"keep","description":"Step up: sqlite_store _mapping_proxy_default + _detect_fact_build __func__ path — +6 covered (2500→2506), 92.2%","timestamp":1774154018776,"segment":0}
{"run":10,"commit":"df16f68","metric":18.33,"metrics":{"covered_lines":2512,"coverage_pct":92.5,"miss":133,"test_time_s":4.97,"test_loc":9266,"branch_pct":86.2},"status":"keep","description":"Step up: _extract_field edges + _raw_to_fold_state scalars — +6 covered (2506→2512), 92.5%","timestamp":1774154160975,"segment":0}
{"run":11,"commit":"f823883","metric":21.43,"metrics":{"covered_lines":2513,"coverage_pct":92.5,"miss":132,"test_time_s":5.77,"test_loc":9335,"branch_pct":86.4},"status":"keep","description":"Step up: discover vertex_fold path + discover skips — +1 covered (2512→2513), 92.5%","timestamp":1774154264292,"segment":0}
{"type":"config","name":"lang test coverage efficiency (stairstep)","metricName":"efficiency","metricUnit":"","bestDirection":"lower"}
{"run":1,"commit":"4aa8b59","metric":3.21,"metrics":{"covered_lines":1118,"coverage_pct":86.9,"miss":122,"test_time_s":1.3,"test_loc":2757,"branch_pct":79.5},"status":"keep","description":"Baseline: lang 86.9%, 1118/1240 covered, 122 miss, efficiency=3.21","timestamp":1774154352387,"segment":0}
{"run":2,"commit":"8c34d9c","metric":3.22,"metrics":{"covered_lines":1132,"coverage_pct":88.4,"miss":108,"test_time_s":1.27,"test_loc":2874,"branch_pct":81.7},"status":"keep","description":"Step up: loader edge cases (select/transform/explode errors) + errors repr/eq/str — +14 covered (1118→1132), 88.4%","timestamp":1774154449465,"segment":0}
{"run":3,"commit":"7237eaf","metric":9.8,"metrics":{"covered_lines":1144,"coverage_pct":89.7,"miss":96,"test_time_s":3.67,"test_loc":3055,"branch_pct":83.9},"status":"keep","description":"Step up: loader error paths (project/where/flatten/fold/boundary/loop) — +12 covered (1132→1144), 89.7%","timestamp":1774154558798,"segment":0}
{"run":4,"commit":"7c074f3","metric":6.55,"metrics":{"covered_lines":1155,"coverage_pct":90.7,"miss":85,"test_time_s":2.42,"test_loc":3126,"branch_pct":85.2},"status":"keep","description":"Step up: validator shape/context + where/explode/flatten on non-dict — +11 covered (1144→1155), 90.7%","timestamp":1774154674519,"segment":0}
{"run":5,"commit":"034a545","metric":4.55,"metrics":{"covered_lines":1166,"coverage_pct":91.8,"miss":74,"test_time_s":1.67,"test_loc":3175,"branch_pct":86.6},"status":"keep","description":"Step up: ast frozen dataclass edges + Duration + BoundaryCondition — +11 covered (1155→1166), 91.8%","timestamp":1774154775623,"segment":0}
{"run":6,"commit":"7523158","metric":3.93,"metrics":{"covered_lines":1182,"coverage_pct":93.3,"miss":58,"test_time_s":1.4,"test_loc":3316,"branch_pct":88.6},"status":"keep","description":"Step up: loader trigger/origin/fold-param/scope/unknown-key + combine alias — +16 covered (1166→1182), 93.3%","timestamp":1774154879637,"segment":0}
{"run":7,"commit":"4a9d2d3","metric":2.32,"metrics":{"covered_lines":1200,"coverage_pct":94.7,"miss":40,"test_time_s":0.82,"test_loc":3398,"branch_pct":90.1},"status":"keep","description":"Step up: population frozen types + list_file_header edges — +18 covered (1182→1200), 94.7%, efficiency=2.32 (new best!)","timestamp":1774154950609,"segment":0}
{"run":8,"commit":"b26c271","metric":2.95,"metrics":{"covered_lines":1204,"coverage_pct":95.2,"miss":36,"test_time_s":1.02,"test_loc":3488,"branch_pct":90.8},"status":"keep","description":"Step up: loader boundary/template/source/grant errors — +4 covered (1200→1204), 95.2%","timestamp":1774155014180,"segment":0}
{"run":9,"commit":"e70a89b","metric":1.95,"metrics":{"covered_lines":1225,"coverage_pct":97.4,"miss":15,"test_time_s":0.65,"test_loc":3669,"branch_pct":94.3},"status":"keep","description":"Step up: make_row helper + loader/validator/population edges + eq paths — +21 covered (1204→1225), 97.4%, efficiency=1.95 (new best!)","timestamp":1774155405158,"segment":0}
{"run":10,"commit":"0867a11","metric":1.92,"metrics":{"covered_lines":1229,"coverage_pct":97.9,"miss":11,"test_time_s":0.63,"test_loc":3746,"branch_pct":95.1},"status":"keep","description":"Step up: require_arg/where-exists/in/not_in/boundary-after — +4 covered (1225→1229), 97.9%","timestamp":1774155459715,"segment":0}
{"run":11,"commit":"d48c29b","metric":1.88,"metrics":{"covered_lines":1232,"coverage_pct":98.2,"miss":8,"test_time_s":0.61,"test_loc":3791,"branch_pct":95.6},"status":"keep","description":"Step up: where in/not_in empty + frozen optional positional args — +3 covered (1229→1232), 98.2%","timestamp":1774155536314,"segment":0}
{"run":12,"commit":"1e74d63","metric":2.11,"metrics":{"covered_lines":1234,"coverage_pct":98.4,"miss":6,"test_time_s":0.68,"test_loc":3821,"branch_pct":96},"status":"keep","description":"Step up: population template ambiguity + empty header — +2 covered (1232→1234), 98.4%, population.py 100%","timestamp":1774155630019,"segment":0}
{"type":"config","name":"loops app coverage efficiency","metricName":"efficiency","metricUnit":"","bestDirection":"lower"}
{"run":1,"commit":"62eba15","metric":4.53,"metrics":{"covered_lines":2800,"coverage_pct":56.8,"miss":1878,"test_time_s":2.8,"test_loc":4527,"branch_pct":50.1},"status":"keep","description":"Baseline: loops app 56.8%, 2800/4678 covered, 1878 miss, efficiency=4.53","timestamp":1774155737950,"segment":0}
{"run":2,"commit":"f03b7d9","metric":4.25,"metrics":{"covered_lines":2856,"coverage_pct":58.3,"miss":1822,"test_time_s":2.59,"test_loc":4688,"branch_pct":52.1},"status":"keep","description":"Step up: fold.py utility functions (truncate, recency, format, inbound, namespace) — +56 covered (2800→2856), 58.3%","timestamp":1774155892098,"segment":0}
{"run":3,"commit":"47178d8","metric":4.81,"metrics":{"covered_lines":2983,"coverage_pct":61.1,"miss":1695,"test_time_s":2.97,"test_loc":4827,"branch_pct":55.2},"status":"keep","description":"Step up: run.py + ticks.py lens rendering (all zoom levels) — +127 covered (2856→2983), 61.1%","timestamp":1774156053036,"segment":0}
{"run":4,"commit":"cd94d84","metric":5.23,"metrics":{"covered_lines":3001,"coverage_pct":61.6,"miss":1677,"test_time_s":3.2,"test_loc":4905,"branch_pct":55.8},"status":"keep","description":"Step up: validate + vertices lens rendering (all zoom levels) — +18 covered (2983→3001), 61.6%","timestamp":1774156129337,"segment":0}
{"run":5,"commit":"aa4f857","metric":5.06,"metrics":{"covered_lines":3032,"coverage_pct":62.4,"miss":1646,"test_time_s":3.05,"test_loc":5026,"branch_pct":57},"status":"keep","description":"Step up: compile + gist lens tests — +31 covered (3001→3032), 62.4%","timestamp":1774156203157,"segment":0}
{"run":6,"commit":"db5696e","metric":5.63,"metrics":{"covered_lines":3080,"coverage_pct":63.6,"miss":1598,"test_time_s":3.39,"test_loc":5116,"branch_pct":58.5},"status":"keep","description":"Step up: stream lens (all zooms, tick drill-down, date grouping) — +48 covered (3032→3080), 63.6%","timestamp":1774156270266,"segment":0}
{"run":7,"commit":"4fe339e","metric":5.14,"metrics":{"covered_lines":3080,"coverage_pct":63.6,"miss":1598,"test_time_s":3.1,"test_loc":5104,"branch_pct":58.5},"status":"keep","description":"Step down: extract shared block_text() helper, remove 6 duplicates — -12 LOC, efficiency 5.63→5.14","timestamp":1774156391012,"segment":0}
{"run":8,"commit":"e31c603","metric":4.73,"metrics":{"covered_lines":3106,"coverage_pct":64.3,"miss":1572,"test_time_s":2.85,"test_loc":5159,"branch_pct":59.6},"status":"keep","description":"Step up: fold_view rendering (minimal, refs filter, facts filter, footer) — +26 covered (3080→3106), 64.3%","timestamp":1774156469065,"segment":0}
{"run":9,"commit":"a5ebd90","metric":4.97,"metrics":{"covered_lines":3120,"coverage_pct":64.7,"miss":1558,"test_time_s":2.97,"test_loc":5216,"branch_pct":60.2},"status":"keep","description":"Step up: fold_view deeper rendering (detailed, full, grouped, collect, multi-section) — +14 covered (3106→3120), 64.7%","timestamp":1774156532817,"segment":0}
{"run":10,"commit":"252f8e7","metric":5.01,"metrics":{"covered_lines":3129,"coverage_pct":64.9,"miss":1549,"test_time_s":3,"test_loc":5252,"branch_pct":60.6},"status":"keep","description":"Step up: palette kind_style + freshness_style — +9 covered (3120→3129), 64.9%, palette.py 100%","timestamp":1774156615247,"segment":0}
{"run":11,"commit":"3eb6419","metric":4.7,"metrics":{"covered_lines":3134,"coverage_pct":65,"miss":1544,"test_time_s":2.77,"test_loc":5321,"branch_pct":60.7},"status":"keep","description":"Step up: main.py helpers (vertex_name, extract_block, find_local, is_static_plain) — +5 covered (3129→3134), 65.0%","timestamp":1774156802247,"segment":0}
{"run":12,"commit":"5cedad0","metric":5.47,"metrics":{"covered_lines":3145,"coverage_pct":65.3,"miss":1533,"test_time_s":3.2,"test_loc":5375,"branch_pct":61.1},"status":"keep","description":"Step up: test lens + pop lens (all zoom levels, edge cases) — +11 covered (3134→3145), 65.3%","timestamp":1774156945842,"segment":0}
{"run":13,"commit":"6bb7dbf","metric":5.65,"metrics":{"covered_lines":3154,"coverage_pct":65.6,"miss":1524,"test_time_s":3.29,"test_loc":5419,"branch_pct":61.5},"status":"keep","description":"Step up: sync lens (format_ago/interval/skip, minimal, summary) — +9 covered (3145→3154), 65.6%","timestamp":1774157028739,"segment":0}
{"run":14,"commit":"b8b3888","metric":5.41,"metrics":{"covered_lines":3168,"coverage_pct":65.9,"miss":1510,"test_time_s":3.11,"test_loc":5510,"branch_pct":62},"status":"keep","description":"Step up: compile vertex FULL path, sync errors/ticks/children, stream width=None/key_field branches, lens_resolver path+broken-file — +14 covered (3154→3168), 65.9%","timestamp":1774157217963,"segment":0}
{"run":15,"commit":"0317f44","metric":5.73,"metrics":{"covered_lines":3206,"coverage_pct":66.9,"miss":1472,"test_time_s":3.26,"test_loc":5631,"branch_pct":63.3},"status":"keep","description":"Step up: fold deep rendering (refs filter, salience, body truncation, badges, FULL meta, facts visible) — +38 covered (3168→3206), 66.9%","timestamp":1774157383406,"segment":0}
{"run":16,"commit":"d4f283f","metric":5.61,"metrics":{"covered_lines":3214,"coverage_pct":67.1,"miss":1464,"test_time_s":3.17,"test_loc":5690,"branch_pct":63.7},"status":"keep","description":"Step up: gist/run/vertices/helpers/pop_store 1-2 miss edges — +8 covered (3206→3214), 67.1%","timestamp":1774157552980,"segment":0}
{"run":17,"commit":"56d64e2","metric":5.03,"metrics":{"covered_lines":3214,"coverage_pct":67.1,"miss":1464,"test_time_s":2.91,"test_loc":5554,"branch_pct":63.7},"status":"keep","description":"Step down: module-level imports in run/ticks/stream/sync lens tests — -136 LOC, efficiency 5.61→5.03","timestamp":1774157709565,"segment":0}
{"run":18,"commit":"a7def6d","metric":4.81,"metrics":{"covered_lines":3214,"coverage_pct":67.1,"miss":1464,"test_time_s":2.82,"test_loc":5479,"branch_pct":63.7},"status":"keep","description":"Step down: module-level imports in test_fold_utils.py (-75 LOC) — efficiency 5.03→4.81","timestamp":1774157804644,"segment":0}
{"run":19,"commit":"a7def6d","metric":5.11,"metrics":{"covered_lines":3214,"coverage_pct":67.1,"miss":1464,"test_time_s":3.09,"test_loc":5315,"branch_pct":63.7},"status":"discard","description":"Discard: module-level imports in remaining test files — no coverage gain, efficiency worse (5.11 vs 4.81) due to timing noise; reverting","timestamp":1774158202833,"segment":0}
{"run":20,"commit":"81703b4","metric":5.67,"metrics":{"covered_lines":3222,"coverage_pct":67.4,"miss":1456,"test_time_s":3.3,"test_loc":5534,"branch_pct":64.1},"status":"keep","description":"Step up: store lens utility functions (empty store, large count, naive datetime, future time, time_range) — +8 covered (3214→3222), 67.4%","timestamp":1774158457705,"segment":0}
{"run":21,"commit":"9a6ec4e","metric":5.02,"metrics":{"covered_lines":3235,"coverage_pct":67.7,"miss":1443,"test_time_s":2.91,"test_loc":5581,"branch_pct":64.4},"status":"keep","description":"Step up: store lens narrow fill+recent payloads + vertices fetch_vertices_local — +13 covered (3222→3235), 67.7%","timestamp":1774158609914,"segment":0}
{"run":22,"commit":"6dbfd1a","metric":5.53,"metrics":{"covered_lines":3237,"coverage_pct":67.7,"miss":1441,"test_time_s":3.19,"test_loc":5613,"branch_pct":64.4},"status":"keep","description":"Step up: identity _read_observers invalid + single/multi observer auto-resolve — +2 covered (3235→3237), 67.7%","timestamp":1774158688842,"segment":0}
{"run":23,"commit":"11392ad","metric":4.99,"metrics":{"covered_lines":3248,"coverage_pct":68,"miss":1430,"test_time_s":2.87,"test_loc":5642,"branch_pct":64.7},"status":"keep","description":"Step up: _walk_root discover/no-discover/broken-child paths — +11 covered (3237→3248), 68.0%","timestamp":1774158783112,"segment":0}
{"run":24,"commit":"55939a7","metric":3.33,"metrics":{"covered_lines":3251,"coverage_pct":68,"miss":1427,"test_time_s":1.91,"test_loc":5675,"branch_pct":64.8},"status":"keep","description":"Step up: vertices _walk_root combine + fetch_local broken-child — +3 covered (3248→3251), efficiency=3.33 (new best!)","timestamp":1774158871220,"segment":0}
