{"run":25,"commit":"6d82e12","metric":3.63,"metrics":{"covered_lines":3253,"coverage_pct":68.1,"miss":1425,"test_time_s":2.07,"test_loc":5698,"branch_pct":64.8},"status":"keep","description":"Step up: _resolve_vertex_path explicit+home paths — +2 covered (3251→3253), 68.1%","timestamp":1774158962159,"segment":0}
{"run":26,"commit":"41185bc","metric":3.39,"metrics":{"covered_lines":3257,"coverage_pct":68.1,"miss":1421,"test_time_s":1.93,"test_loc":5714,"branch_pct":64.8},"status":"keep","description":"Step up: _extract_kind_keys + _get_vertex_lens_decl exception paths — +4 covered (3253→3257), 68.1%","timestamp":1774159020862,"segment":0}
{"run":27,"commit":"cc93581","metric":3.14,"metrics":{"covered_lines":3264,"coverage_pct":68.3,"miss":1414,"test_time_s":1.79,"test_loc":5731,"branch_pct":65},"status":"keep","description":"Step up: _resolve_named_store not-found + no-store errors — +7 covered (3257→3264), 68.3%, efficiency=3.14 (new best!)","timestamp":1774159112364,"segment":0}
{"run":28,"commit":"4d59a46","metric":3.11,"metrics":{"covered_lines":3268,"coverage_pct":68.4,"miss":1410,"test_time_s":1.77,"test_loc":5743,"branch_pct":65},"status":"keep","description":"Step up: _dispatch_verb_first unknown + _apply_vertex_scope OSError — +4 covered (3264→3268), 68.4%, efficiency=3.11 (new best!)","timestamp":1774159190940,"segment":0}
{"run":29,"commit":"0c2b81e","metric":2.59,"metrics":{"covered_lines":3273,"coverage_pct":68.5,"miss":1405,"test_time_s":1.47,"test_loc":5772,"branch_pct":65.3},"status":"keep","description":"Step up: _resolve_named_store success + _add_produced fallback — +5 covered (3268→3273), 68.5%, efficiency=2.59 (best!)","timestamp":1774159314973,"segment":0}
{"run":30,"commit":"f4814fe","metric":3.11,"metrics":{"covered_lines":3280,"coverage_pct":68.6,"miss":1398,"test_time_s":1.76,"test_loc":5792,"branch_pct":65.3},"status":"keep","description":"Step up: _execute_boundary_run (subprocess + OSError) + _warn_missing_fold_key — +7 covered (3273→3280), 68.6%","timestamp":1774159376180,"segment":0}
{"run":31,"commit":"0840bd4","metric":3.41,"metrics":{"covered_lines":3287,"coverage_pct":68.8,"miss":1391,"test_time_s":1.92,"test_loc":5837,"branch_pct":65.6},"status":"keep","description":"Step up: combine path resolution in _resolve_combine/_writable/_store — +7 covered (3280→3287), 68.8%","timestamp":1774159447833,"segment":0}
{"run":32,"commit":"be71ccd","metric":2.66,"metrics":{"covered_lines":3290,"coverage_pct":68.9,"miss":1388,"test_time_s":1.49,"test_loc":5873,"branch_pct":65.6},"status":"keep","description":"Step up: _find_source_vertex paths (lens block, store directive) + fix trivial test warnings — +3 covered (3287→3290), 68.9%","timestamp":1774159593878,"segment":0}
{"run":33,"commit":"55680d6","metric":3.5,"metrics":{"covered_lines":3307,"coverage_pct":69.2,"miss":1371,"test_time_s":1.96,"test_loc":5900,"branch_pct":65.9},"status":"keep","description":"Step up: _run_whoami + _warn_missing_fold_key exception path — +17 covered (3290→3307), 69.2%","timestamp":1774159696781,"segment":0}
{"run":34,"commit":"2b4b77d","metric":3.12,"metrics":{"covered_lines":3308,"coverage_pct":69.2,"miss":1370,"test_time_s":1.75,"test_loc":5904,"branch_pct":65.9},"status":"keep","description":"Step up: stream _block width=None path — +1 covered (3307→3308), 69.2%","timestamp":1774159791908,"segment":0}
{"run":35,"commit":"6e06508","metric":3.17,"metrics":{"covered_lines":3310,"coverage_pct":69.3,"miss":1368,"test_time_s":1.77,"test_loc":5931,"branch_pct":66},"status":"keep","description":"Step up: _register_with_aggregator early returns (already-registered, combine-at-start) — +2 covered (3308→3310), 69.3%","timestamp":1774159883832,"segment":0}
{"run":36,"commit":"1e08bba","metric":3.23,"metrics":{"covered_lines":3311,"coverage_pct":69.3,"miss":1367,"test_time_s":1.8,"test_loc":5943,"branch_pct":66.1},"status":"keep","description":"Step up: main() no-argv + help dispatch paths — +1 covered (3310→3311), 69.3%","timestamp":1774159940511,"segment":0}
{"run":37,"commit":"a049cd3","metric":3.16,"metrics":{"covered_lines":3312,"coverage_pct":69.3,"miss":1366,"test_time_s":1.76,"test_loc":5943,"branch_pct":66.1},"status":"keep","description":"Step up: _find_source_vertex store-only path (no loops block) — +1 covered (3311→3312), 69.3%","timestamp":1774160031641,"segment":0}
{"run":38,"commit":"a38a475","metric":3.15,"metrics":{"covered_lines":3321,"coverage_pct":69.6,"miss":1357,"test_time_s":1.75,"test_loc":5982,"branch_pct":66.4},"status":"keep","description":"Step up: _collect_combine_observers exception + discover + resolve_local_vertex — +9 covered (3312→3321), 69.6%","timestamp":1774160170859,"segment":0}
{"run":39,"commit":"b7486c8","metric":2.64,"metrics":{"covered_lines":3324,"coverage_pct":69.6,"miss":1354,"test_time_s":1.46,"test_loc":6006,"branch_pct":66.5},"status":"keep","description":"Step up: vertices combine nonexistent + broken vertex edge cases — +3 covered (3321→3324), 69.6%, efficiency=2.64 (new best!)","timestamp":1774160306261,"segment":0}
{"run":40,"commit":"06a27e0","metric":3.37,"metrics":{"covered_lines":3326,"coverage_pct":69.7,"miss":1352,"test_time_s":1.86,"test_loc":6027,"branch_pct":66.6},"status":"keep","description":"Step up: _dispatch_observer close/store paths with mocks — +2 covered (3324→3326), 69.7%","timestamp":1774160409640,"segment":0}
{"run":41,"commit":"4803c0e","metric":3.41,"metrics":{"covered_lines":3339,"coverage_pct":69.9,"miss":1339,"test_time_s":1.86,"test_loc":6119,"branch_pct":66.7},"status":"keep","description":"Step up: main.py edge paths — sync nonexistent/bad-var, validate error, help JSON, cmd_init iterations/seed, aggregate child-no-sources — +13 covered (3326→3339), 69.9%","timestamp":1774160810855,"segment":0}
{"run":42,"commit":"52023a2","metric":3.34,"metrics":{"covered_lines":3379,"coverage_pct":70.7,"miss":1299,"test_time_s":1.83,"test_loc":6163,"branch_pct":67.3},"status":"keep","description":"Step up: sync run-boundary fires (L989-990) + aggregate child-no-sources (L832) + cmd_init seed/iterations — +40 covered (3339→3379), 70.7% (crossed 70%!)","timestamp":1774161145314,"segment":0}
{"run":43,"commit":"9cb4844","metric":2.8,"metrics":{"covered_lines":3463,"coverage_pct":72.4,"miss":1215,"test_time_s":1.55,"test_loc":6256,"branch_pct":68.7},"status":"keep","description":"Step up: _run_fold_fast/render_fold_plain (--static --plain), _run_test (error paths + echo loop + limit), _scaffold_artifacts (benchmark/checks scripts) — +84 covered (3379→3463), 72.4%!","timestamp":1774161319256,"segment":0}
{"run":44,"commit":"3e2e44b","metric":2.49,"metrics":{"covered_lines":3571,"coverage_pct":74.6,"miss":1107,"test_time_s":1.41,"test_loc":6309,"branch_pct":70.6},"status":"keep","description":"Step up: _render_fold_plain MINIMAL/SUMMARY with data, _run_ticks list/drill/range/vertex-path — +108 covered (3463→3571), 74.6%! efficiency=2.49 (new best!)","timestamp":1774161482094,"segment":0}
{"run":45,"commit":"f6ed49f","metric":3.45,"metrics":{"covered_lines":3593,"coverage_pct":75.1,"miss":1085,"test_time_s":1.95,"test_loc":6356,"branch_pct":71.2},"status":"keep","description":"Step up: _render_fold_plain collect items + body/truncation paths, _run_fold via full dispatch, --refs/--facts flags — +22 covered (3571→3593), 75.1%","timestamp":1774161646833,"segment":0}
{"run":46,"commit":"270c835","metric":3.36,"metrics":{"covered_lines":3598,"coverage_pct":75.2,"miss":1080,"test_time_s":1.9,"test_loc":6370,"branch_pct":71.4},"status":"keep","description":"Step up: --lens autoresearch handler setup (L2165-2166,2182), --lens reconcile custom lens path (L1916-1918) — +5 covered (3593→3598), 75.2%","timestamp":1774161876820,"segment":0}
{"run":47,"commit":"c6edef9","metric":2.93,"metrics":{"covered_lines":3607,"coverage_pct":75.4,"miss":1071,"test_time_s":1.64,"test_loc":6435,"branch_pct":71.7},"status":"keep","description":"Step up: _init_local_vertex iterations substitution + lenses copy, _run_stream --id not-found/ambiguous — +9 covered (3598→3607), 75.4%","timestamp":1774161984781,"segment":0}
{"run":48,"commit":"c6edef9","metric":3.46,"metrics":{"covered_lines":3607,"coverage_pct":75.4,"miss":1071,"test_time_s":1.94,"test_loc":6424,"branch_pct":71.7},"status":"discard","description":"Step down: merged validate+test error paths with parametrize — same coverage but efficiency slightly worse (3.46 vs 2.93), likely timing variance","timestamp":1774162085117,"segment":0}
{"run":49,"commit":"9f7b8a5","metric":3,"metrics":{"covered_lines":3615,"coverage_pct":75.6,"miss":1063,"test_time_s":1.68,"test_loc":6454,"branch_pct":71.9},"status":"keep","description":"Step up: cmd_emit legacy vertex resolution (emit by name L1621, explicit path error L1630-1633) — +8 covered (3607→3615), 75.6%","timestamp":1774162172908,"segment":0}
{"run":50,"commit":"52ba53b","metric":3.45,"metrics":{"covered_lines":3640,"coverage_pct":76.1,"miss":1038,"test_time_s":1.93,"test_loc":6501,"branch_pct":72.3},"status":"keep","description":"Step up: _try_topology_from_store full path (emit topology + read back), empty store, no store — +25 covered (3615→3640), 76.1%","timestamp":1774162308599,"segment":0}
{"run":51,"commit":"126c974","metric":3.53,"metrics":{"covered_lines":3641,"coverage_pct":76.1,"miss":1037,"test_time_s":1.97,"test_loc":6526,"branch_pct":72.3},"status":"keep","description":"Step up: _run_test --input mode (nonexistent file L645, happy parse path) — +1 covered (3640→3641), 76.1%","timestamp":1774162403544,"segment":0}
{"run":52,"commit":"4b70d18","metric":3.61,"metrics":{"covered_lines":3650,"coverage_pct":76.4,"miss":1028,"test_time_s":2.01,"test_loc":6549,"branch_pct":72.8},"status":"keep","description":"Step up: _run_close dry-run (found+resolved) + not-found error — +9 covered (3641→3650), 76.4%","timestamp":1774162503061,"segment":0}
{"run":53,"commit":"e2aae58","metric":3.67,"metrics":{"covered_lines":3651,"coverage_pct":76.4,"miss":1027,"test_time_s":2.04,"test_loc":6562,"branch_pct":72.9},"status":"keep","description":"Step up: _run_close without explicit vertex (L2601 resolve_local_vertex) — +1 covered (3650→3651), 76.4%","timestamp":1774162590284,"segment":0}
{"run":54,"commit":"c4f82c1","metric":3.69,"metrics":{"covered_lines":3666,"coverage_pct":76.8,"miss":1012,"test_time_s":2.04,"test_loc":6626,"branch_pct":73.2},"status":"keep","description":"Step up: _resolve_combine_child (alias match, no-match, no-combine, bad-file) — +15 covered (3651→3666), 76.8%","timestamp":1774162745798,"segment":0}
{"run":55,"commit":"dfcb919","metric":2.99,"metrics":{"covered_lines":3673,"coverage_pct":76.9,"miss":1005,"test_time_s":1.65,"test_loc":6648,"branch_pct":73.5},"status":"keep","description":"Step up: _whoami_from_identity_store identity vertex + no-vertex paths — +7 covered (3666→3673), 76.9%","timestamp":1774162836282,"segment":0}
{"run":56,"commit":"797f75b","metric":3.64,"metrics":{"covered_lines":3677,"coverage_pct":77,"miss":1001,"test_time_s":2.01,"test_loc":6660,"branch_pct":73.6},"status":"keep","description":"Step up: vertex lens{} declaration (Tier 2 in _resolve_render_fn L1924-1927) — +4 covered (3673→3677), 77.0%!","timestamp":1774162947321,"segment":0}
{"run":57,"commit":"3f3da16","metric":3.15,"metrics":{"covered_lines":3704,"coverage_pct":77.6,"miss":974,"test_time_s":1.74,"test_loc":6697,"branch_pct":74.1},"status":"keep","description":"Step up: fetch_tick_facts + _get_fold_meta (fold_by key_field) + fetch_ticks (kind_counts) — +27 covered (3677→3704), 77.6%!, miss under 1000!","timestamp":1774163100758,"segment":0}
{"run":58,"commit":"98ca85a","metric":3.76,"metrics":{"covered_lines":3735,"coverage_pct":78.3,"miss":943,"test_time_s":2.09,"test_loc":6720,"branch_pct":74.8},"status":"keep","description":"Step up: fetch_tick_range (multi-tick union, no-ticks error), fetch_tick_range_fold — +31 covered (3704→3735), 78.3%!","timestamp":1774163206999,"segment":0}
{"run":59,"commit":"670b1c4","metric":3.84,"metrics":{"covered_lines":3736,"coverage_pct":78.3,"miss":942,"test_time_s":2.13,"test_loc":6734,"branch_pct":74.9},"status":"keep","description":"Step up: fetch_fold kind filter skip (L82), fetch_tick_range out-of-range error — +1 covered (3735→3736), 78.3%","timestamp":1774163295293,"segment":0}
{"run":60,"commit":"79388bb","metric":3.2,"metrics":{"covered_lines":3736,"coverage_pct":78.3,"miss":942,"test_time_s":1.78,"test_loc":6724,"branch_pct":74.9},"status":"keep","description":"Step down: merged TestRunTest error paths + echo+limit into 2 tests — efficiency 3.84→3.20, same coverage","timestamp":1774163383914,"segment":0}
{"run":61,"commit":"79388bb","metric":3.7,"metrics":{"covered_lines":3736,"coverage_pct":78.3,"miss":942,"test_time_s":2.07,"test_loc":6685,"branch_pct":74.9},"status":"discard","description":"Step down: compressed TestMainEdgePaths — same coverage but efficiency worse (3.70 > 3.20), timing noise dominated","timestamp":1774163472187,"segment":0}
{"run":62,"commit":"cb33f55","metric":3.84,"metrics":{"covered_lines":3744,"coverage_pct":78.5,"miss":934,"test_time_s":2.13,"test_loc":6758,"branch_pct":75.1},"status":"keep","description":"Step up: _resolve_vertex_for_dispatch slash-qualified combine child (L1540-1554) — +8 covered (3736→3744), 78.5%","timestamp":1774163550276,"segment":0}
{"run":63,"commit":"6f6dacd","metric":3.74,"metrics":{"covered_lines":3744,"coverage_pct":78.5,"miss":934,"test_time_s":2.1,"test_loc":6674,"branch_pct":75.1},"status":"keep","description":"Step down: moved 57 inline imports to module level — -84 LOC, efficiency 3.84→3.74, same coverage","timestamp":1774163732844,"segment":0}
{"run":64,"commit":"01431a4","metric":3.69,"metrics":{"covered_lines":3750,"coverage_pct":78.6,"miss":928,"test_time_s":2.07,"test_loc":6690,"branch_pct":75.2},"status":"keep","description":"Step up: _scaffold_artifacts iterate.sh template copy (L407-413) + no-vertex_name early return — +6 covered (3744→3750), 78.6%","timestamp":1774163808588,"segment":0}
{"run":65,"commit":"0f41d6f","metric":4.12,"metrics":{"covered_lines":3751,"coverage_pct":78.6,"miss":927,"test_time_s":2.3,"test_loc":6713,"branch_pct":75.2},"status":"keep","description":"Step up: _try_fast_read two-positionals (L3391), no-static (L3394), named-vertex fallback (L3399) — +1 covered (3750→3751), 78.6%","timestamp":1774164141449,"segment":0}
{"run":66,"commit":"f5e691c","metric":3.3,"metrics":{"covered_lines":3754,"coverage_pct":78.7,"miss":924,"test_time_s":1.84,"test_loc":6725,"branch_pct":75.3},"status":"keep","description":"Step up: _run_compile nonexistent file (L1052-1053) + unknown suffix (L1100) — +3 covered (3751→3754), 78.7%","timestamp":1774164218082,"segment":0}
{"run":67,"commit":"bf50bbf","metric":3.21,"metrics":{"covered_lines":3760,"coverage_pct":78.9,"miss":918,"test_time_s":1.79,"test_loc":6750,"branch_pct":75.5},"status":"keep","description":"Step up: _run_ticks ValueError in range (L2926), out-of-range error render (L2973), local vertex (L2946-2947) — +6 covered (3754→3760), 78.9%","timestamp":1774164307316,"segment":0}
{"run":68,"commit":"4a28e3c","metric":3.2,"metrics":{"covered_lines":3761,"coverage_pct":78.9,"miss":917,"test_time_s":1.78,"test_loc":6759,"branch_pct":75.6},"status":"keep","description":"Step up: _run_stream without vertex (L2017 resolve_local_vertex) — +1 covered (3760→3761), 78.9%","timestamp":1774164404040,"segment":0}
{"run":69,"commit":"a1d8b4c","metric":3.8,"metrics":{"covered_lines":3764,"coverage_pct":79,"miss":914,"test_time_s":2.11,"test_loc":6783,"branch_pct":75.7},"status":"keep","description":"Step up: _render_fold_plain multi-section separator (L2237) + narrow-width truncation (L2277) — +3 covered (3761→3764), 79.0%!","timestamp":1774164494545,"segment":0}
{"run":70,"commit":"b087507","metric":3.47,"metrics":{"covered_lines":3765,"coverage_pct":79,"miss":913,"test_time_s":1.92,"test_loc":6797,"branch_pct":75.8},"status":"keep","description":"Step up: _run_store via vertex-first dispatch (L2384 vertex_path set) — +1 covered (3764→3765), 79.0%","timestamp":1774164585993,"segment":0}
{"run":71,"commit":"6ceabf4","metric":3.9,"metrics":{"covered_lines":3771,"coverage_pct":79.2,"miss":907,"test_time_s":2.16,"test_loc":6809,"branch_pct":76},"status":"keep","description":"Step up: cmd_emit kind-as-vertex (L1636-1644 kind reinterpretation + local vertex find) — +6 covered (3765→3771), 79.2%","timestamp":1774164725267,"segment":0}
{"run":72,"commit":"be7c80a","metric":3.36,"metrics":{"covered_lines":3774,"coverage_pct":79.2,"miss":904,"test_time_s":1.86,"test_loc":6823,"branch_pct":76.1},"status":"keep","description":"Step up: cmd_emit no-vertex error (L1646-1652) + LOOPS_THREAD auto-tag (L1661) — +3 covered (3771→3774), 79.2%","timestamp":1774164804727,"segment":0}
{"run":73,"commit":"deb4079","metric":3.93,"metrics":{"covered_lines":3775,"coverage_pct":79.3,"miss":903,"test_time_s":2.17,"test_loc":6833,"branch_pct":76.2},"status":"keep","description":"Step up: cmd_emit --dry-run on no-store vertex (L1683) — +1 covered (3774→3775), 79.3%","timestamp":1774164893000,"segment":0}
{"run":74,"commit":"4f82041","metric":4.01,"metrics":{"covered_lines":3777,"coverage_pct":79.3,"miss":901,"test_time_s":2.21,"test_loc":6859,"branch_pct":76.2},"status":"keep","description":"Step up: _run_sync_aggregate error source log_error (L818-819) — +2 covered (3775→3777), 79.3%","timestamp":1774164972878,"segment":0}
{"run":75,"commit":"8d430df","metric":4.06,"metrics":{"covered_lines":3779,"coverage_pct":79.4,"miss":899,"test_time_s":2.23,"test_loc":6877,"branch_pct":76.3},"status":"keep","description":"Step up: fetch_tick_range_fold no-ticks (L525) + out-of-range (L531-535) error paths — +2 covered (3777→3779), 79.4%","timestamp":1774165122497,"segment":0}
{"run":76,"commit":"caddee9","metric":3.4,"metrics":{"covered_lines":3779,"coverage_pct":79.4,"miss":899,"test_time_s":1.87,"test_loc":6864,"branch_pct":76.3},"status":"keep","description":"Step down: merged 3 classes (store+emit paths) into TestMiscEdgePaths — efficiency 4.06→3.40, same coverage","timestamp":1774165225163,"segment":0}
{"run":77,"commit":"f15cd14","metric":4.12,"metrics":{"covered_lines":3782,"coverage_pct":79.5,"miss":896,"test_time_s":2.26,"test_loc":6895,"branch_pct":76.5},"status":"keep","description":"Step up: _whoami no-matching-item (L2825) + _run_sync error source log_error (L971-972) — +3 covered (3779→3782), 79.5%","timestamp":1774165327879,"segment":0}
{"run":78,"commit":"48d89f7","metric":3.47,"metrics":{"covered_lines":3784,"coverage_pct":79.5,"miss":894,"test_time_s":1.9,"test_loc":6918,"branch_pct":76.6},"status":"keep","description":"Step up: _run_sync_aggregate child run boundary (L837-838) — +2 covered (3782→3784), 79.5%","timestamp":1774165424890,"segment":0}
{"run":79,"commit":"48d89f7","metric":4.03,"metrics":{"covered_lines":3784,"coverage_pct":79.5,"miss":894,"test_time_s":2.2,"test_loc":6938,"branch_pct":76.6},"status":"discard","description":"_resolve_vertex_for_dispatch config-level combine path (L1552-1554) — 0 new covered, efficiency 3.47→4.03","timestamp":1774165510011,"segment":0}
{"run":80,"commit":"48d89f7","metric":4.13,"metrics":{"covered_lines":3784,"coverage_pct":79.6,"miss":894,"test_time_s":2.26,"test_loc":6920,"branch_pct":76.6},"status":"discard","description":"fetch_fold kind/key filter to hit L82 — 0 new covered (L82 was already covered), efficiency worse 3.47→4.13","timestamp":1774165746669,"segment":0}
{"run":81,"commit":"e8a7821","metric":3.6,"metrics":{"covered_lines":3785,"coverage_pct":79.6,"miss":893,"test_time_s":1.97,"test_loc":6924,"branch_pct":76.8},"status":"keep","description":"Step up: _run_fold_fast -vv zoom_level=3 (L2307) — +1 covered (3784→3785), 79.6%","timestamp":1774165834764,"segment":0}
{"run":82,"commit":"be18a69","metric":4.27,"metrics":{"covered_lines":3786,"coverage_pct":79.7,"miss":892,"test_time_s":2.33,"test_loc":6935,"branch_pct":76.9},"status":"keep","description":"Step up: vertex lens{} stream declaration (L1928-1931) in _resolve_render_fn Tier 2 — +1 covered (3785→3786), 79.7%","timestamp":1774165920346,"segment":0}
{"run":83,"commit":"7b15398","metric":3.49,"metrics":{"covered_lines":3786,"coverage_pct":79.7,"miss":892,"test_time_s":1.91,"test_loc":6918,"branch_pct":76.9},"status":"keep","description":"Step down: merged TestVertexLensDecl+TestStreamLensVertex + TestSyncLogError into existing classes — efficiency 4.27→3.49, same coverage","timestamp":1774166042917,"segment":0}
{"run":84,"commit":"0b8ad88","metric":4.22,"metrics":{"covered_lines":3787,"coverage_pct":79.7,"miss":891,"test_time_s":2.31,"test_loc":6924,"branch_pct":76.9},"status":"keep","description":"Step up: _run_fold_fast with --lens (L2341 custom render path) — +1 covered (3786→3787), 79.7%","timestamp":1774166137866,"segment":0}
{"run":85,"commit":"8067db4","metric":4.17,"metrics":{"covered_lines":3787,"coverage_pct":79.7,"miss":891,"test_time_s":2.28,"test_loc":6921,"branch_pct":76.9},"status":"keep","description":"Step down: merged TestStreamQueryPath into TestRunStreamPaths — efficiency 4.22→4.17, same coverage","timestamp":1774166218572,"segment":0}
{"run":86,"commit":"8067db4","metric":3.46,"metrics":{"covered_lines":3787,"coverage_pct":79.7,"miss":891,"test_time_s":1.89,"test_loc":6932,"branch_pct":76.9},"status":"discard","description":"_run_close kind-shift path — 0 new covered (already covered by close_without_vertex test), efficiency improved 4.17→3.46","timestamp":1774166289824,"segment":0}
{"run":87,"commit":"f170327","metric":4.15,"metrics":{"covered_lines":3790,"coverage_pct":79.8,"miss":888,"test_time_s":2.27,"test_loc":6934,"branch_pct":77},"status":"keep","description":"Step up: cmd_emit slash-split template qualifier (L1626-1629) — +3 covered (3787→3790), 79.8%","timestamp":1774166412042,"segment":0}
